{"content_origin":"PROJECT_AUTHORED","lessons":[{"content_sections":[{"body":"In Long-form exposition and concession lesson 36, distinguish an observation from an inference. State the claim precisely, qualify it where evidence is limited, and make the relation between reasons and conclusion explicit.","id":"focus","section_type":"explanation","target_ids":["c2t_u06_grammar"],"title":"Analytical focus"},{"body":"For long-form exposition and concession, a strong contribution identifies a relevant tension, explains why it matters, and proposes a proportionate response. The wording in this model is original material for lesson 36.","id":"application","section_type":"reading","target_ids":["c2t_u06_vocabulary_senses","c2t_u06_pronunciation"],"title":"Model contribution"}],"duration_minutes":35,"exercises":[{"correct_answer":"The evidence in Long-form exposition and concession lesson 36 warrants a qualified conclusion.","id":"select","media_required":false,"options":["The evidence in Long-form exposition and concession lesson 36 warrants a qualified conclusion.","Every issue in Long-form exposition and concession lesson 36 has one certain answer.","Details are unnecessary in Long-form exposition and concession lesson 36."],"prompt":"Choose the statement that best frames long-form exposition and concession in lesson 36.","target_ids":["c2t_u06_grammar"],"type":"multiple_choice"},{"acceptable_answers":["appropriately qualified for Long-form exposition and concession lesson 36"],"id":"complete","media_required":false,"prompt":"Complete the claim for Long-form exposition and concession lesson 36: The discussion should remain ____ rather than absolute.","target_ids":["c2t_u06_pronunciation"],"type":"fill_blank"},{"id":"compose","media_required":false,"prompt":"Write 90 to 120 words presenting a nuanced position on long-form exposition and concession for lesson 36.","rubric":{"criteria":["Addresses the specific issue in Long-form exposition and concession lesson 36.","Uses a reasoned qualification appropriate to long-form exposition and concession."]},"target_ids":["c2t_u06_grammar","c2t_u06_vocabulary_senses","c2t_u06_pronunciation"],"type":"writing"}],"lesson_id":"m16c2-v1-c2-u08-l01","objective_target_ids":["c2t_u06_grammar","c2t_u06_vocabulary_senses","c2t_u06_pronunciation"],"objectives":["Use the allocated C2 resources to address long-form exposition and concession.","Produce a qualified, coherent contribution for Long-form exposition and concession lesson 36."],"practice":{"listening":{"answer":"Its likely effects need further examination.","constraints":["Keep the transcript private before the attempt.","Ask one question after the transcript."],"goal":"Identify a qualified claim about long-form exposition and concession.","instruction":"Read the private transcript once, then answer the question for Long-form exposition and concession lesson 36.","media_required":false,"question":"What qualification does the speaker make in Long-form exposition and concession lesson 36?","target_ids":["c2t_u06_grammar"],"transcript":"For Long-form exposition and concession lesson 36, the speaker says that the proposal is promising, although its likely effects need further examination."},"pronunciation":{"constraints":["Assess pronunciation only when audio is supplied.","Return NOT_ASSESSED without audio."],"goal":"Control prominence in a qualified C2 claim for lesson 36.","instruction":"Record and repeat the sentence about Long-form exposition and concession lesson 36, marking contrastive stress.","target":"The evidence warrants a qualified conclusion in lesson 36.","target_ids":["c2t_u06_grammar"],"without_audio":"NOT_ASSESSED"},"speaking":{"constraints":["Take no more than two turns.","Respond to the stated counterpoint."],"goal":"Present and refine a claim about long-form exposition and concession.","instruction":"Discuss one defensible position on long-form exposition and concession in a two-turn exchange for lesson 36.","target_ids":["c2t_u06_grammar","c2t_u06_vocabulary_senses","c2t_u06_pronunciation"]},"writing":{"constraints":["Request a learner draft before feedback.","Give feedback without replacing the learner text."],"feedback_boundary":"FEEDBACK_ONLY_NO_REPLACEMENT","goal":"Revise a nuanced paragraph for Long-form exposition and concession lesson 36.","instruction":"Draft a concise analytical paragraph about long-form exposition and concession for lesson 36; then request feedback.","target_ids":["c2t_u06_grammar","c2t_u06_vocabulary_senses","c2t_u06_pronunciation"]}},"title":"Framing long-form exposition and concession"},{"content_sections":[{"body":"In Long-form exposition and concession lesson 37, distinguish an observation from an inference. State the claim precisely, qualify it where evidence is limited, and make the relation between reasons and conclusion explicit.","id":"focus","section_type":"explanation","target_ids":["c2t_u06_functions"],"title":"Analytical focus"},{"body":"For long-form exposition and concession, a strong contribution identifies a relevant tension, explains why it matters, and proposes a proportionate response. The wording in this model is original material for lesson 37.","id":"application","section_type":"reading","target_ids":["c2t_u06_discourse","c2t_u06_lexical_chunks"],"title":"Model contribution"}],"duration_minutes":35,"exercises":[{"correct_answer":"The evidence in Long-form exposition and concession lesson 37 warrants a qualified conclusion.","id":"select","media_required":false,"options":["The evidence in Long-form exposition and concession lesson 37 warrants a qualified conclusion.","Every issue in Long-form exposition and concession lesson 37 has one certain answer.","Details are unnecessary in Long-form exposition and concession lesson 37."],"prompt":"Choose the statement that best frames long-form exposition and concession in lesson 37.","target_ids":["c2t_u06_functions"],"type":"multiple_choice"},{"acceptable_answers":["appropriately qualified for Long-form exposition and concession lesson 37"],"id":"complete","media_required":false,"prompt":"Complete the claim for Long-form exposition and concession lesson 37: The discussion should remain ____ rather than absolute.","target_ids":["c2t_u06_lexical_chunks"],"type":"fill_blank"},{"id":"compose","media_required":false,"prompt":"Write 90 to 120 words presenting a nuanced position on long-form exposition and concession for lesson 37.","rubric":{"criteria":["Addresses the specific issue in Long-form exposition and concession lesson 37.","Uses a reasoned qualification appropriate to long-form exposition and concession."]},"target_ids":["c2t_u06_functions","c2t_u06_discourse","c2t_u06_lexical_chunks"],"type":"writing"}],"lesson_id":"m16c2-v1-c2-u08-l02","objective_target_ids":["c2t_u06_functions","c2t_u06_discourse","c2t_u06_lexical_chunks"],"objectives":["Use the allocated C2 resources to address long-form exposition and concession.","Produce a qualified, coherent contribution for Long-form exposition and concession lesson 37."],"practice":{"listening":{"answer":"Its likely effects need further examination.","constraints":["Keep the transcript private before the attempt.","Ask one question after the transcript."],"goal":"Identify a qualified claim about long-form exposition and concession.","instruction":"Read the private transcript once, then answer the question for Long-form exposition and concession lesson 37.","media_required":false,"question":"What qualification does the speaker make in Long-form exposition and concession lesson 37?","target_ids":["c2t_u06_functions"],"transcript":"For Long-form exposition and concession lesson 37, the speaker says that the proposal is promising, although its likely effects need further examination."},"pronunciation":{"constraints":["Assess pronunciation only when audio is supplied.","Return NOT_ASSESSED without audio."],"goal":"Control prominence in a qualified C2 claim for lesson 37.","instruction":"Record and repeat the sentence about Long-form exposition and concession lesson 37, marking contrastive stress.","target":"The evidence warrants a qualified conclusion in lesson 37.","target_ids":["c2t_u06_functions"],"without_audio":"NOT_ASSESSED"},"speaking":{"constraints":["Take no more than two turns.","Respond to the stated counterpoint."],"goal":"Present and refine a claim about long-form exposition and concession.","instruction":"Discuss one defensible position on long-form exposition and concession in a two-turn exchange for lesson 37.","target_ids":["c2t_u06_functions","c2t_u06_discourse","c2t_u06_lexical_chunks"]},"writing":{"constraints":["Request a learner draft before feedback.","Give feedback without replacing the learner text."],"feedback_boundary":"FEEDBACK_ONLY_NO_REPLACEMENT","goal":"Revise a nuanced paragraph for Long-form exposition and concession lesson 37.","instruction":"Draft a concise analytical paragraph about long-form exposition and concession for lesson 37; then request feedback.","target_ids":["c2t_u06_functions","c2t_u06_discourse","c2t_u06_lexical_chunks"]}},"title":"Developing long-form exposition and concession"},{"content_sections":[{"body":"In Long-form exposition and concession lesson 38, distinguish an observation from an inference. State the claim precisely, qualify it where evidence is limited, and make the relation between reasons and conclusion explicit.","id":"focus","section_type":"explanation","target_ids":["c2t_u06_pragmatics","c2t_u06_collocations"],"title":"Analytical focus"},{"body":"For long-form exposition and concession, a strong contribution identifies a relevant tension, explains why it matters, and proposes a proportionate response. The wording in this model is original material for lesson 38.","id":"application","section_type":"reading","target_ids":["c2t_u06_topics","c2t_u06_skills"],"title":"Model contribution"}],"duration_minutes":35,"exercises":[{"correct_answer":"The evidence in Long-form exposition and concession lesson 38 warrants a qu